{
  "draft_id": "application-001-cv",
  "kind": "cv",
  "market": "MENA",
  "name": "Ahmed El Sanhoury",
  "jd_ref": "outputs/gated/application-001/jd-analysis.md (SAMPLE JD)",
  "note": "Structured form of cv-variant.md, SAN APPROVED 2026-07-18. Every line cites fact ids from data/facts.jsonl and an approved variant.",
  "sections": [
    {
      "section_id": "header",
      "kind": "header",
      "lines": [
        {
          "line_id": "H-1",
          "text": "ahmed@asanhoury.com · asanhoury.com · linkedin.com/in/ahmed-el-sanhoury",
          "fact_ids": [
            "ID-email",
            "ID-website",
            "ID-linkedin_slug"
          ],
          "variant_id": "V-app001-H-1"
        }
      ]
    },
    {
      "section_id": "summary",
      "kind": "summary",
      "lines": [
        {
          "line_id": "S-1",
          "text": "Builds the systems that run marketing, not just the campaigns. 16+ years across open source, EdTech, SaaS, FinTech, and agency; Arabic-first operator since 2014; 10M+ combined organic audience grown across the career.",
          "fact_ids": [
            "POS-sentence",
            "POS-cv_descriptor",
            "AGY-significance",
            "HL-career_combined_audience"
          ],
          "variant_id": "V-app001-S-1"
        }
      ]
    },
    {
      "section_id": "MAH",
      "kind": "role",
      "entry_id": "MAH",
      "title": "Senior Director, Marketing, Communications & Product",
      "org": "Maharat",
      "dates": "2025 to Present",
      "subtitle": {
        "line_id": "MAH-sub",
        "text": "EdTech serving MENA · AED 350K+ annual ad spend across KSA and UAE · reports to the CEO",
        "fact_ids": [
          "MAH-location-2",
          "MAH-budget",
          "MAH-reporting"
        ],
        "variant_id": "V-app001-MAH-sub"
      },
      "lines": [
        {
          "line_id": "MAH-1",
          "text": "Built multi-agent content and campaign pipelines with human-approval gates: 21 agents, 4 swarm patterns, a 73-skill layer with formal evals, at approval-ready and dev-handoff-ready state.",
          "fact_ids": [
            "MAH-systems-1"
          ],
          "variant_id": "V-app001-MAH-1"
        },
        {
          "line_id": "MAH-2",
          "text": "Run Arabic-first lifecycle marketing across the funnel, from acquisition and onboarding through retention and win-back.",
          "fact_ids": [
            "MAH-marketing-1"
          ],
          "variant_id": "V-app001-MAH-2"
        },
        {
          "line_id": "MAH-3",
          "text": "Shipped two complete learning paths (10 levels, ~120 lessons each) behind a governed content production system, QA'd end to end.",
          "fact_ids": [
            "MAH-systems-2"
          ],
          "variant_id": "V-app001-MAH-3"
        }
      ]
    },
    {
      "section_id": "CAN",
      "kind": "role",
      "entry_id": "CAN",
      "title": "Marketing and Communications Manager",
      "org": "Canonical (Ubuntu)",
      "dates": "2022 to 2025",
      "subtitle": {
        "line_id": "CAN-sub",
        "text": "Enterprise open source · $250K budget",
        "fact_ids": [
          "CAN-location-2",
          "CAN-budget"
        ],
        "variant_id": "V-app001-CAN-sub"
      },
      "lines": [
        {
          "line_id": "CAN-1",
          "text": "Led marketing communications, content marketing, and social media campaigns; partnered with product marketing, regional marketing, and PMs.",
          "fact_ids": [
            "CAN-scope_exact"
          ],
          "variant_id": "V-app001-CAN-1"
        },
        {
          "line_id": "CAN-2",
          "text": "Grew the organic audience 3x to 3M across five platforms with zero paid follower spend; LinkedIn 90K to 500K+ with a 109K-subscriber newsletter.",
          "fact_ids": [
            "CAN-audience-1a",
            "CAN-audience-1b",
            "CAN-audience-1c",
            "CAN-audience-2a"
          ],
          "variant_id": "V-app001-CAN-2"
        },
        {
          "line_id": "CAN-3",
          "text": "Turned social into a pipeline channel: MQLs up 21x in one year (36 to 785), Salesforce-tracked; $5M+ enterprise pipeline influenced.",
          "fact_ids": [
            "CAN-pipeline-1a",
            "CAN-pipeline-1c"
          ],
          "variant_id": "V-app001-CAN-3"
        },
        {
          "line_id": "CAN-4",
          "text": "Directed the social side of 20+ global launches with Dell, Intel, NVIDIA, and Framework; took Ubuntu Summit earned media from $519K to $7.93M in three years.",
          "fact_ids": [
            "CAN-launches_and_content-1b",
            "CAN-earned_media-1a"
          ],
          "variant_id": "V-app001-CAN-4"
        }
      ]
    },
    {
      "section_id": "earlier",
      "kind": "earlier",
      "lines": [
        {
          "line_id": "E-1",
          "text": "Head of PR & Partnerships, Mindvalley (2017 to 2020, promoted 3x): YouTube Gold Play Button, 125K to 1M subscribers in under a year; $2.8M+ earned media.",
          "fact_ids": [
            "MVL-org",
            "MVL-title",
            "MVL-dates",
            "MVL-audience-2",
            "MVL-earned_media-1a"
          ],
          "variant_id": "V-app001-E-1"
        },
        {
          "line_id": "E-2",
          "text": "Fractional Marketing Director, Goodwall (2019 to 2020).",
          "fact_ids": [
            "GDW-org",
            "GDW-title",
            "GDW-dates"
          ],
          "variant_id": "V-app001-E-2"
        },
        {
          "line_id": "E-3",
          "text": "Head of Marketing, Payd (2021 to 2022) and Agiliux (2020 to 2021).",
          "fact_ids": [
            "PAY-org",
            "PAY-title",
            "PAY-dates",
            "AGI-org",
            "AGI-dates"
          ],
          "variant_id": "V-app001-E-3"
        },
        {
          "line_id": "E-4",
          "text": "Agency and early career 2010 to 2017 across Falcon, Socialeyez, and BSocial: USD 19M client budgets, bilingual Arabic-English work for Etisalat, Canon, and Dubai government entities.",
          "fact_ids": [
            "AGY-org",
            "AGY-title",
            "AGY-dates",
            "AGY-budget",
            "AGY-agency-2a",
            "AGY-agency-2b"
          ],
          "variant_id": "V-app001-E-4"
        }
      ]
    }
  ]
}
